{
  "candidates": [
    {
      "chart_data_path": "results/public/chart-data/cost-curves-effort/benchmark-01/cost-per-request.json",
      "dimension_keys": [
        "effort",
        "model"
      ],
      "family_key": "cost-curves-effort",
      "schema_semver": "0.1.0",
      "series_keys": [
        "mean_usd_per_request",
        "std_usd_per_request",
        "n_used"
      ],
      "source_sanitized_sha256": [
        "828fde4ea960654ca5914377eb6d7783367fe8a69edc5df0c705bedd158a4a42"
      ],
      "target_topic_slug": "reasoning-cost-quality-latency-by-effort",
      "tier": "SANITIZED_PUBLIC",
      "units_key": "usd_per_request"
    },
    {
      "chart_data_path": "results/public/chart-data/cost-curves-effort/benchmark-01/latency.json",
      "dimension_keys": [
        "effort",
        "model"
      ],
      "family_key": "cost-curves-effort",
      "schema_semver": "0.1.0",
      "series_keys": [
        "mean_latency_ms",
        "std_latency_ms",
        "n_used"
      ],
      "source_sanitized_sha256": [
        "6266935346d4065a368a93a5960259fc9eb0b90a6fa0e25ccdc60414a52c336d"
      ],
      "target_topic_slug": "reasoning-cost-quality-latency-by-effort",
      "tier": "SANITIZED_PUBLIC",
      "units_key": "milliseconds"
    },
    {
      "chart_data_path": "results/public/chart-data/cost-curves-effort/benchmark-01/quality.json",
      "dimension_keys": [
        "effort",
        "model"
      ],
      "family_key": "cost-curves-effort",
      "schema_semver": "0.1.0",
      "series_keys": [
        "mean_judge_score",
        "std_judge_score",
        "judge_n"
      ],
      "source_sanitized_sha256": [
        "6446716c85826faa2e1126257ab000e3329c59a3be1c681ec014ffc0a8fe6111"
      ],
      "target_topic_slug": "reasoning-cost-quality-latency-by-effort",
      "tier": "SANITIZED_PUBLIC",
      "units_key": "judge_score"
    },
    {
      "chart_data_path": "results/public/chart-data/cost-curves-effort/benchmark-01/throughput-gain.json",
      "dimension_keys": [
        "effort",
        "model"
      ],
      "family_key": "cost-curves-effort",
      "schema_semver": "0.1.0",
      "series_keys": [
        "throughput_gain_factor",
        "tokens_per_request",
        "baseline_tokens_per_request"
      ],
      "source_sanitized_sha256": [
        "dc7af5f3910e59259496293cf7b2a4659aad5301ce101e32a62bace9939af81c"
      ],
      "target_topic_slug": "reasoning-cost-quality-latency-by-effort",
      "tier": "SANITIZED_PUBLIC",
      "units_key": "factor"
    },
    {
      "chart_data_path": "results/public/chart-data/cost-curves-effort/benchmark-02/cost-per-request.json",
      "dimension_keys": [
        "effort",
        "model"
      ],
      "family_key": "cost-curves-effort",
      "schema_semver": "0.1.0",
      "series_keys": [
        "mean_usd_per_request",
        "std_usd_per_request",
        "n_used"
      ],
      "source_sanitized_sha256": [
        "f52caaca7dac9d6a691f00069b357edb3b9373d383f2037f9327357665095b01"
      ],
      "target_topic_slug": "reasoning-cost-quality-latency-by-effort",
      "tier": "SANITIZED_PUBLIC",
      "units_key": "usd_per_request"
    },
    {
      "chart_data_path": "results/public/chart-data/cost-curves-effort/benchmark-02/latency.json",
      "dimension_keys": [
        "effort",
        "model"
      ],
      "family_key": "cost-curves-effort",
      "schema_semver": "0.1.0",
      "series_keys": [
        "mean_latency_ms",
        "std_latency_ms",
        "n_used"
      ],
      "source_sanitized_sha256": [
        "dcaee17680b4b5aa1d3a81a8747e08a76cf9592be9556fa2d6763f5e5fab810e"
      ],
      "target_topic_slug": "reasoning-cost-quality-latency-by-effort",
      "tier": "SANITIZED_PUBLIC",
      "units_key": "milliseconds"
    },
    {
      "chart_data_path": "results/public/chart-data/cost-curves-effort/benchmark-02/quality.json",
      "dimension_keys": [
        "effort",
        "model"
      ],
      "family_key": "cost-curves-effort",
      "schema_semver": "0.1.0",
      "series_keys": [
        "mean_judge_score",
        "std_judge_score",
        "judge_n"
      ],
      "source_sanitized_sha256": [
        "8e988fb65e0bf54b2ad2f5308fdf1e24594bb63866d2248fa069304fdc12110b"
      ],
      "target_topic_slug": "reasoning-cost-quality-latency-by-effort",
      "tier": "SANITIZED_PUBLIC",
      "units_key": "judge_score"
    },
    {
      "chart_data_path": "results/public/chart-data/cost-curves-effort/benchmark-02/throughput-gain.json",
      "dimension_keys": [
        "effort",
        "model"
      ],
      "family_key": "cost-curves-effort",
      "schema_semver": "0.1.0",
      "series_keys": [
        "throughput_gain_factor",
        "tokens_per_request",
        "baseline_tokens_per_request"
      ],
      "source_sanitized_sha256": [
        "bdeac983ea365be022a4415dabaa09c38dc9a9ab40d20b345eff1ce57700c41b"
      ],
      "target_topic_slug": "reasoning-cost-quality-latency-by-effort",
      "tier": "SANITIZED_PUBLIC",
      "units_key": "factor"
    },
    {
      "chart_data_path": "results/public/chart-data/cost-curves-effort/benchmark-03/cost-per-request.json",
      "dimension_keys": [
        "effort",
        "model"
      ],
      "family_key": "cost-curves-effort",
      "schema_semver": "0.1.0",
      "series_keys": [
        "mean_usd_per_request",
        "std_usd_per_request",
        "n_used"
      ],
      "source_sanitized_sha256": [
        "813e8473845def79b8368e78b0b57c4c904b2d6221e9fa82ad92960d6e08bc14"
      ],
      "target_topic_slug": "reasoning-cost-quality-latency-by-effort",
      "tier": "SANITIZED_PUBLIC",
      "units_key": "usd_per_request"
    },
    {
      "chart_data_path": "results/public/chart-data/cost-curves-effort/benchmark-03/latency.json",
      "dimension_keys": [
        "effort",
        "model"
      ],
      "family_key": "cost-curves-effort",
      "schema_semver": "0.1.0",
      "series_keys": [
        "mean_latency_ms",
        "std_latency_ms",
        "n_used"
      ],
      "source_sanitized_sha256": [
        "fbb1b14caea853b9c3310d7725b23da68ce589e4a615d662568aec780a62e389"
      ],
      "target_topic_slug": "reasoning-cost-quality-latency-by-effort",
      "tier": "SANITIZED_PUBLIC",
      "units_key": "milliseconds"
    },
    {
      "chart_data_path": "results/public/chart-data/cost-curves-effort/benchmark-03/quality.json",
      "dimension_keys": [
        "effort",
        "model"
      ],
      "family_key": "cost-curves-effort",
      "schema_semver": "0.1.0",
      "series_keys": [
        "mean_judge_score",
        "std_judge_score",
        "judge_n"
      ],
      "source_sanitized_sha256": [
        "597a0ceecb41fd313288ec00a68159da4a7065942cfc9fb7296d554e307bc4c0"
      ],
      "target_topic_slug": "reasoning-cost-quality-latency-by-effort",
      "tier": "SANITIZED_PUBLIC",
      "units_key": "judge_score"
    },
    {
      "chart_data_path": "results/public/chart-data/cost-curves-effort/benchmark-03/throughput-gain.json",
      "dimension_keys": [
        "effort",
        "model"
      ],
      "family_key": "cost-curves-effort",
      "schema_semver": "0.1.0",
      "series_keys": [
        "throughput_gain_factor",
        "tokens_per_request",
        "baseline_tokens_per_request"
      ],
      "source_sanitized_sha256": [
        "8f5c390deeaa5e0a255e99e445b43f36f2923c2cbc010fcb34068927add8d8f1"
      ],
      "target_topic_slug": "reasoning-cost-quality-latency-by-effort",
      "tier": "SANITIZED_PUBLIC",
      "units_key": "factor"
    },
    {
      "chart_data_path": "results/public/chart-data/ptu-payg-crossover/benchmark-01/crossover.json",
      "dimension_keys": [
        "effort",
        "model"
      ],
      "family_key": "ptu-payg-crossover",
      "schema_semver": "0.1.0",
      "series_keys": [
        "mean_usd_per_request",
        "throughput_gain_factor",
        "modeled_break_even_rpm",
        "ptu_hourly_rate_usd",
        "min_ptu",
        "n_used"
      ],
      "source_sanitized_sha256": [
        "4f134f58a1f0f9c08da0eadccc4eef2155d151fde31dfa52ecaaf92a15d3cd20",
        "87be18be649e36ee40db307cfa32c540b831fc732088feec617f28dc9992b702",
        "7004e832d9a57ea483578d217d3c9b290b9e5decd42894ab35b7c31b578684a2",
        "42ebe760aaf6325f46bc1976e736cc65b82dff2f03ded541dad9f4a874e7eb66"
      ],
      "target_topic_slug": "reasoning-ptu-payg-crossover",
      "tier": "SANITIZED_PUBLIC",
      "units_key": "mixed_usd_rpm"
    },
    {
      "chart_data_path": "results/public/chart-data/ptu-payg-crossover/benchmark-02/crossover.json",
      "dimension_keys": [
        "effort",
        "model"
      ],
      "family_key": "ptu-payg-crossover",
      "schema_semver": "0.1.0",
      "series_keys": [
        "mean_usd_per_request",
        "throughput_gain_factor",
        "modeled_break_even_rpm",
        "ptu_hourly_rate_usd",
        "min_ptu",
        "n_used"
      ],
      "source_sanitized_sha256": [
        "8e25beb787c76a1541c555dc3fa1386d617438533ca49fee1c03e4094a8e0d21",
        "b25ea80bb7cde708a26946d71864be8019a8d50f166e44090fafb050e72fc96a",
        "f4a39ff4ffe1fc3376ba4bb92bb2d2a4273b0cfc6c1022b0a8d2e8aa5d4aa535",
        "4cd4f9d99e978d48a6fcc9f7eda429e8dd1baf9ca557a27096476fa071a5b2b1"
      ],
      "target_topic_slug": "reasoning-ptu-payg-crossover",
      "tier": "SANITIZED_PUBLIC",
      "units_key": "mixed_usd_rpm"
    },
    {
      "chart_data_path": "results/public/chart-data/ptu-payg-crossover/benchmark-03/crossover.json",
      "dimension_keys": [
        "effort",
        "model"
      ],
      "family_key": "ptu-payg-crossover",
      "schema_semver": "0.1.0",
      "series_keys": [
        "mean_usd_per_request",
        "throughput_gain_factor",
        "modeled_break_even_rpm",
        "ptu_hourly_rate_usd",
        "min_ptu",
        "n_used"
      ],
      "source_sanitized_sha256": [
        "69b49013b778028b143c051cba763f094fc8d71a27024a10367e3d1e2a5d285f",